Sentence,Category
The team celebrated their championship win with a grand parade through the city.,Sports
Serena Williams broke another record at the Australian Open with her powerful serve.,Sports
The coach implemented a new strategy to improve the team's defensive line.,Sports
"The marathon runner finished in under two hours, setting a new world record.",Sports
The soccer match was postponed due to heavy rain and unsafe playing conditions.,Sports
The company reported a 15% increase in quarterly profits due to higher sales.,Business
The board of directors met to discuss the upcoming merger with a major competitor.,Business
The startup received venture capital funding to accelerate its product development.,Business
The CEO announced a new initiative to enhance employee work-life balance.,Business
The market research indicated a growing demand for eco-friendly consumer products.,Business
Scientists discovered a new exoplanet in the habitable zone of its star system.,Science
The research team published their findings on the effects of climate change on coral reefs.,Science
A breakthrough in quantum computing could revolutionize data processing speeds.,Science
The experiment aimed to understand the genetic basis of inherited diseases.,Science
"Astronomers observed unusual activity in a distant galaxy, leading to new theories about dark matter.",Science
